{
  "artifacts": {
    "evidence_coverage": {
      "exists": true,
      "kind": "file",
      "passed": true,
      "path": "evidence_coverage.json",
      "schema_version": "hfr.evidence_coverage.v1",
      "sha256": "58e4028195de67aa23932504a77e2d9f8ebb1839f5d5c2740ff1aa94a7a2688a",
      "size_bytes": 8640
    },
    "harness_manifest_1": {
      "exists": true,
      "kind": "file",
      "passed": null,
      "path": "harness_handoff/harness_manifest.json",
      "schema_version": "hfr.harness_run_manifest.v1",
      "sha256": "03f685fd15a0afb06e4f65e62bae45d9fb4481b95c5ed796a4b7e7b16baa2b5e",
      "size_bytes": 1527
    },
    "harness_result_1": {
      "exists": true,
      "kind": "file",
      "passed": null,
      "path": "harness_handoff/harness_result.json",
      "schema_version": "hfr.harness_run_result.v1",
      "sha256": "52dbc05d6366fb1200fd601226bd4ba7943f220ac9d291299ccdbee1a813b9fe",
      "size_bytes": 2987
    },
    "repair_queue": {
      "exists": true,
      "kind": "file",
      "passed": true,
      "path": "repair_queue.json",
      "schema_version": "hfr.repair_queue.v1",
      "sha256": "0ad3cf4bbab35ef05fe4b65948e31b2b4aa5e02b4975efb476f73c3b7868e18e",
      "size_bytes": 691
    },
    "runs_dir": {
      "entry_count": 11,
      "exists": true,
      "kind": "directory",
      "path": "."
    },
    "scenario_quality": {
      "exists": true,
      "kind": "file",
      "passed": true,
      "path": "scenario_quality.json",
      "schema_version": "hfr.scenario_quality.v1",
      "sha256": "6c213414329dfe102d96d03305b777d3472e4fda944d29eabe7d8a2bcc3075fe",
      "size_bytes": 2266
    },
    "suite_summary": {
      "exists": true,
      "kind": "file",
      "passed": null,
      "path": "suite_summary.json",
      "schema_version": "hfr.run_suite.v1",
      "sha256": "bfd2da8ca7e383e18459e7988f0932874927baa4fc9065a78eb2d21804450f25",
      "size_bytes": 2721
    },
    "trace_observability": {
      "exists": true,
      "kind": "file",
      "passed": true,
      "path": "trace_observability.json",
      "schema_version": "hfr.trace_observability.v1",
      "sha256": "fb45157b5e220153d9a5c2d6ec4f142d6f9532f9b5230f71544307318f79ba2f",
      "size_bytes": 2101
    },
    "validation": {
      "exists": true,
      "kind": "file",
      "passed": true,
      "path": "validation.json",
      "schema_version": "hfr.validation.v1",
      "sha256": "6ceaf402c44843b71d22b6760d0ac03260406a85db92ef771c9a021007a81416",
      "size_bytes": 2343
    }
  },
  "bundle_path": "evidence_handoff/evidence_bundle.json",
  "check_count": 17,
  "checks": [
    {
      "actual": {
        "passed": true
      },
      "expected": {
        "passed": true
      },
      "id": "runs_dir_exists",
      "passed": true,
      "scope": {
        "artifact": "runs_dir"
      },
      "summary": "runs_dir_exists: passed=True"
    },
    {
      "actual": {
        "passed": true
      },
      "expected": {
        "passed": true
      },
      "id": "run_digest_coverage_complete",
      "passed": true,
      "scope": {
        "artifact": "runs_dir",
        "completed_runs": "1",
        "invalid_digest_count": "0",
        "missing_digest_count": "0"
      },
      "summary": "run_digest_coverage_complete: passed=True"
    },
    {
      "actual": {
        "passed": true
      },
      "expected": {
        "passed": true
      },
      "id": "suite_summary_no_errors",
      "passed": true,
      "scope": {
        "artifact": "suite_summary"
      },
      "summary": "suite_summary_no_errors: passed=True"
    },
    {
      "actual": {
        "passed": true
      },
      "expected": {
        "passed": true
      },
      "id": "scenario_quality_passed",
      "passed": true,
      "scope": {
        "artifact": "scenario_quality"
      },
      "summary": "scenario_quality_passed: passed=True"
    },
    {
      "actual": {
        "passed": true
      },
      "expected": {
        "passed": true
      },
      "id": "evidence_coverage_passed",
      "passed": true,
      "scope": {
        "artifact": "evidence_coverage"
      },
      "summary": "evidence_coverage_passed: passed=True"
    },
    {
      "actual": {
        "passed": true
      },
      "expected": {
        "passed": true
      },
      "id": "trace_observability_passed",
      "passed": true,
      "scope": {
        "artifact": "trace_observability"
      },
      "summary": "trace_observability_passed: passed=True"
    },
    {
      "actual": {
        "passed": true
      },
      "expected": {
        "passed": true
      },
      "id": "repair_queue_passed",
      "passed": true,
      "scope": {
        "artifact": "repair_queue"
      },
      "summary": "repair_queue_passed: passed=True"
    },
    {
      "actual": {
        "passed": true
      },
      "expected": {
        "passed": true
      },
      "id": "validation_passed",
      "passed": true,
      "scope": {
        "artifact": "validation"
      },
      "summary": "validation_passed: passed=True"
    },
    {
      "actual": {
        "passed": true
      },
      "expected": {
        "passed": true
      },
      "id": "validation_has_targets",
      "passed": true,
      "scope": {
        "artifact": "validation",
        "target_count": "8"
      },
      "summary": "validation_has_targets: passed=True"
    },
    {
      "actual": {
        "passed": true
      },
      "expected": {
        "passed": true
      },
      "id": "validation_counts_consistent",
      "passed": true,
      "scope": {
        "artifact": "validation",
        "error_count": "0",
        "passed": "true",
        "strict": "true",
        "warning_count": "0"
      },
      "summary": "validation_counts_consistent: passed=True"
    },
    {
      "actual": {
        "passed": true
      },
      "expected": {
        "passed": true
      },
      "id": "harness_handoff_pair_count",
      "passed": true,
      "scope": {
        "artifact": "harness_handoff",
        "manifest_count": "1",
        "result_count": "1"
      },
      "summary": "harness_handoff_pair_count: passed=True"
    },
    {
      "actual": {
        "passed": true
      },
      "expected": {
        "passed": true
      },
      "id": "harness_pair_schema_valid",
      "passed": true,
      "scope": {
        "artifact": "harness_handoff",
        "provider": "flightrecorder",
        "runner": "flightrecorder_run_suite",
        "scenario_id": "prompt_injection_good"
      },
      "summary": "harness_pair_schema_valid: passed=True"
    },
    {
      "actual": {
        "passed": true
      },
      "expected": {
        "passed": true
      },
      "id": "harness_pair_artifacts_valid",
      "passed": true,
      "scope": {
        "artifact": "harness_handoff",
        "provider": "flightrecorder",
        "runner": "flightrecorder_run_suite",
        "scenario_id": "prompt_injection_good"
      },
      "summary": "harness_pair_artifacts_valid: passed=True"
    },
    {
      "actual": {
        "passed": true
      },
      "expected": {
        "passed": true
      },
      "id": "harness_pair_consistent",
      "passed": true,
      "scope": {
        "artifact": "harness_handoff",
        "provider": "flightrecorder",
        "runner": "flightrecorder_run_suite",
        "scenario_id": "prompt_injection_good"
      },
      "summary": "harness_pair_consistent: passed=True"
    },
    {
      "actual": {
        "passed": true
      },
      "expected": {
        "passed": true
      },
      "id": "harness_result_passed",
      "passed": true,
      "scope": {
        "artifact": "harness_handoff",
        "provider": "flightrecorder",
        "runner": "flightrecorder_run_suite",
        "scenario_id": "prompt_injection_good"
      },
      "summary": "harness_result_passed: passed=True"
    },
    {
      "actual": {
        "passed": true
      },
      "expected": {
        "passed": true
      },
      "id": "run_suite_harness_lineage_valid",
      "passed": true,
      "scope": {
        "artifact": "harness_handoff",
        "provider": "flightrecorder",
        "runner": "flightrecorder_run_suite",
        "scenario_id": "prompt_injection_good"
      },
      "summary": "run_suite_harness_lineage_valid: passed=True"
    },
    {
      "actual": {
        "passed": true
      },
      "expected": {
        "passed": true
      },
      "id": "harness_handoff_present",
      "passed": true,
      "scope": {
        "artifact": "harness_handoff"
      },
      "summary": "harness_handoff_present: passed=True"
    }
  ],
  "decision": {
    "blocking_check_count": 0,
    "blocking_checks": [],
    "blocking_gates": [],
    "evidence_artifacts": [
      "evidence_coverage",
      "harness_manifest_1",
      "harness_result_1",
      "repair_queue",
      "runs_dir",
      "scenario_quality",
      "suite_summary",
      "trace_observability",
      "validation"
    ],
    "gate_count": 0,
    "key_metrics": {
      "evidence_coverage": {
        "critical_failed_rule_evidence_rate": 1.0,
        "critical_failed_rules_without_evidence": 0,
        "failed_rule_evidence_rate": 1.0,
        "failed_rules_without_evidence": 0
      },
      "harness_handoff": {
        "artifact_valid_pair_count": 1,
        "consistent_pair_count": 1,
        "failed_pair_count": 0,
        "manifest_count": 1,
        "missing_pair_count": 0,
        "models": [
          {
            "count": 1,
            "id": "fixture-model"
          }
        ],
        "pair_count": 1,
        "passed_pair_count": 1,
        "providers": [
          {
            "count": 1,
            "id": "flightrecorder"
          }
        ],
        "result_count": 1,
        "run_suite_lineage_valid_pair_count": 1,
        "run_suite_pair_count": 1,
        "runners": [
          {
            "count": 1,
            "id": "flightrecorder_run_suite"
          }
        ],
        "schema_valid_pair_count": 1,